{
  "$schema": "https://json-schema.org/draft/2020-12/schema",
  "type": "object",
  "properties": {
    "demo": {
      "type": "boolean"
    },
    "generated_at": {
      "type": "string"
    },
    "top_scam_categories": {
      "type": "array"
    },
    "top_entities": {
      "type": "array"
    },
    "trend": {
      "type": "array"
    }
  }
}